<?xml version="1.0" encoding="euc-kr" standalone="no"?>
<!DOCTYPE superEntry SYSTEM "2007cl.dtd">
<superEntry>
	<orth>두</orth>
	<entry pos="cl">
		<mnt_grp>
			<cre>
				<cre_date>2000/09/30</cre_date>
				<cre_writer>김진해</cre_writer>
			</cre>
			<mod>
				<mod_date>2000/10/18</mod_date>
				<mod_writer>김진해</mod_writer>
			</mod>
			<mod>
				<mod_date>2001/01/10</mod_date>
				<mod_writer>김진해</mod_writer>
			</mod>
			<mod>
				<mod_date>2001/10/15</mod_date>
			</mod>
			<mod>
				<mod_date>2003/07/29</mod_date>
				<mod_writer>김종인</mod_writer>
			</mod>
			<note>상세기술</note>
		</mnt_grp>
		<morph_grp>
			<org lg="si">頭</org>
					<hom exist="yes"/>
		</morph_grp>
		<sense n="1">
			<sem_grp>
				<eg>소 열 ~를 기르다</eg>
				<eg>돼지 다섯 ~를 샀다</eg>
				<cl_subtype type="uni"/>
				<rel_n>말</rel_n>
				<lr>
					<syn type="etc">마리</syn>
				</lr>
			</sem_grp>
			<syn_grp>
				<flt possible="n-mdq-cl"/>
				<flt possible="mdq-cl-eui-n"/>
				<carord car="ko" ord="etc"/>
			</syn_grp>
		</sense>
	</entry>
	<entry pos="cl">
		<mnt_grp>
			<cre>
				<cre_date>2001/08/02</cre_date>
				<cre_writer>김종인</cre_writer>
			</cre>
			<mod>
				<mod_date>2001/08/02</mod_date>
			</mod>
		</mnt_grp>
		<morph_grp>
			<org lg="si">斗</org>
					<hom exist="yes"/>
		</morph_grp>
		<sense n="1">
			<sem_grp>
				<eg>보리 서 ~가 없어서 남의 집에 얹혀 산다</eg>
				<cl_subtype type="blk">10되</cl_subtype>
				<rel_n>곡식</rel_n>
				<lr>
					<syn type="etc">말</syn>
				</lr>
			</sem_grp>
			<syn_grp>
				<flt possible="n-mdq-cl"/>
				<flt possible="mdq-cl-eui-n"/>
				<flt possible="mdq-cl"/>
				<carord car="ko" ord="etc"/>
			</syn_grp>
		</sense>
	</entry>
</superEntry>
