<?xml version="1.0" encoding="euc-kr" standalone="no"?>
<!DOCTYPE superEntry SYSTEM "2007cl.dtd">
<superEntry>
	<orth>에이커</orth>
	<entry pos="cl">
		<mnt_grp>
			<cre>
				<cre_date>2001/09/10</cre_date>
				<cre_writer>김종인</cre_writer>
			</cre>
			<mod>
				<mod_date>2001/09/19</mod_date>
			</mod>
		</mnt_grp>
		<morph_grp>
			<org lg="en">acre</org>
			<symb>ac</symb>
		</morph_grp>
		<sense n="1">
			<sem_grp>
				<eg>이 농장은 넓이가 10만 ~쯤 된다</eg>
				<cl_subtype type="sqr"/>
			</sem_grp>
			<syn_grp>
				<flt possible="n-mdq-cl"/>
				<flt possible="mdq-cl-eui-n"/>
				<flt possible="mdq-cl"/>
				<carord car="si" ord="etc"/>
			</syn_grp>
		</sense>
	</entry>
</superEntry>
